Source,Volume_No,Chapter_No,Hadith_No,Chapter,Text
Sahih Bukhari,1,4,222,Ablution (Wudu'),Narrated by 'Aisha (the mother of faithful believers): A child was brought to Allah's Apostle and it urinated on the garment of the Prophet. The Prophet asked for water and poured it over the soiled place.
Sahih Bukhari,1,4,223,Ablution (Wudu'),"Narrated by Um Qais bint Mihsin: I brought my young son, who had not started eating (ordinary food) to Allah's Apostle who took him and made him sit in his lap. The child urinated on the garment of the Prophet, so he asked for water and poured it over the soiled (area) and did not wash it."
Sahih Bukhari,1,4,224,Ablution (Wudu'),Narrated by Hudhaifa: Once the Prophet went to the dumps of some people and passed urine while standing. He then asked for water and so I brought it to him and he performed ablution.
Sahih Bukhari,1,4,225,Ablution (Wudu'),"Narrated by Hudhaifa': The Prophet and I walked till we reached the dumps of some people. He stood, as any one of you stands, behind a wall and urinated. I went away, but he beckoned me to come. So I approached him and stood near his back till he finished."
Sahih Bukhari,1,4,226,Ablution (Wudu'),"Narrated by Abu Wail: Abu Musa Al-Ash'ari used to lay great stress on the question of urination and he used to say, ""If anyone from Bani Israel happened to soil his clothes with urine, he used to cut that portion away."" Hearing that, Hudhaifa said to Abu Wail, ""I wish he (Abu Musa) didn't (lay great stress on that matter)."" Hudhaifa added, ""Allah's Apostle went to the dumps of some people and urinated while standing."""
Sahih Bukhari,1,4,227,Ablution (Wudu'),"Narrated by Asma': A woman came to the Prophet and said, ""If anyone of us gets menses in her clothes then what should she do?"" He replied, ""She should (take hold of the soiled place), rub it and put it in the water and rub it in order to remove the traces of blood and then pour water over it. Then she can pray in it."""
Sahih Bukhari,1,4,228,Ablution (Wudu'),"Narrated by 'Aisha: Fatima bint Abi Hubaish came to the Prophet and said, ""O Allah's Apostle I get persistent bleeding from the uterus and do not become clean. Shall I give up my prayers?"" Allah's Apostle replied, ""No, because it is from a blood vessel and not the menses. So when your real menses begins give up your prayers and when it has finished wash off the blood (take a bath) and offer your prayers."" Hisham (the sub narrator) narrated that his father had also said, (the Prophet told her): ""Perform ablution for every prayer till the time of the next period comes."""
Sahih Bukhari,1,4,229,Ablution (Wudu'),Narrated by 'Aisha: I used to wash the traces of Janaba (semen) from the clothes of the Prophet and he used to go for prayers while traces of water were still on it (water spots were still visible).
Sahih Bukhari,1,4,230,Ablution (Wudu'),Narrated by 'Aisha as above (229).
Sahih Bukhari,1,4,231,Ablution (Wudu'),"Narrated by Sulaiman bin Yasar: I asked 'Aisha about the clothes soiled with semen. She replied, ""I used to wash it off the clothes of Allah's Apostle and he would go for the prayer while water spots were still visible. """
Sahih Bukhari,1,4,232,Ablution (Wudu'),"Narrated by 'Amr bin Maimun: I heard Sulaiman bin Yasar talking about the clothes soiled with semen. He said that 'Aisha had said, ""I used to wash it off the clothes of Allah's Apostle and he would go for the prayers while water spots were still visible on them."
Sahih Bukhari,1,4,233,Ablution (Wudu'),Narrated by 'Aisha: I used to wash the semen off the clothes of the Prophet and even then I used to notice one or more spots on them.
Sahih Bukhari,1,4,234,Ablution (Wudu'),"Narrated by Abu Qilaba: Anas said, ""Some people of 'Ukl or 'Uraina tribe came to Medina and its climate did not suit them. So the Prophet ordered them to go to the herd of (Milch) camels and to drink their milk and urine (as a medicine). So they went as directed and after they became healthy, they killed the shepherd of the Prophet and drove away all the camels. The news reached the Prophet early in the morning and he sent (men) in their pursuit and they were captured and brought at noon. He then ordered to cut their hands and feet (and it was done), and their eyes were branded with heated pieces of iron, They were put in 'Al-Harra' and when they asked for water, no water was given to them."" Abu Qilaba said, ""Those people committed theft and murder, became infidels after embracing Islam and fought against Allah and His Apostle ."""
Sahih Bukhari,1,4,235,Ablution (Wudu'),"Narrated by Anas: Prior to the construction of the mosque, the Prophet offered the prayers at sheep-folds."
Sahih Bukhari,1,4,236,Ablution (Wudu'),"Narrated by Maimuna: Allah's Apostle was asked regarding ghee (cooking butter) in which a mouse had fallen. He said, ""Take out the mouse and throw away the ghee around it and use the rest."""
Sahih Bukhari,1,4,237,Ablution (Wudu'),"Narrated by Maimuna: The Prophet was asked regarding ghee in which a mouse had fallen. He said, ""Take out the mouse and throw away the ghee around it (and use the rest.)"""
Sahih Bukhari,1,4,238,Ablution (Wudu'),"Narrated by Abu Huraira: The Prophet said, ""A wound which a Muslim receives in Allah's cause will appear on the Day of Resurrection as it was at the time of infliction; blood will be flowing from the wound and its color will be that of the blood but will smell like musk."""
Sahih Bukhari,1,4,239,Ablution (Wudu'),"Narrated by Abu Huraira: Allah's Apostle said, ""We (Muslims) are the last (people to come in the world) but (will be) the foremost (on the Day of Resurrection)."" The same narrator told that the Prophet had said, ""You should not pass urine in stagnant water which is not flowing then (you may need to) wash in it."""
Sahih Bukhari,1,4,240,Ablution (Wudu'),Narrated by 'Abdullah: While Allah's Apostle was prostrating (as stated below).
Sahih Bukhari,1,4,241,Ablution (Wudu'),"Narrated by 'Abdullah bin Mas'ud: Once the Prophet was offering prayers at the Ka'ba. Abu Jahl was sitting with some of his companions. One of them said to the others, ""Who amongst you will bring the abdominal contents (intestines, etc.) of a camel of Bani so and so and put it on the back of Muhammad, when he prostrates?"" The most unfortunate of them got up and brought it. He waited till the Prophet prostrated and then placed it on his back between his shoulders. I was watching but could not do any thing. I wish I had some people with me to hold out against them. They started laughing and falling on one another. Allah's Apostle was in prostration and he did not lift his head up till Fatima (Prophet's daughter) came and threw that (camel's abdominal contents) away from his back. He raised his head and said thrice, ""O Allah! Punish Quraish."" So it was hard for Abu Jahl and his companions when the Prophet invoked Allah against them as they had a conviction that the prayers and invocations were accepted in this city (Mecca). The Prophet said, ""O Allah! Punish Abu Jahl, 'Utba bin Rabi'a, Shaiba bin Rabi'a, Al-Walid bin 'Utba, Umaiya bin Khalaf, and 'Uqba bin Al Mu'it (and he mentioned the seventh whose name I cannot recall). By Allah in Whose Hands my life is, I saw the dead bodies of those persons who were counted by Allah's Apostle in the Qalib (one of the wells) of Badr."
Sahih Bukhari,1,4,242,Ablution (Wudu'),Narrated by Anas: The Prophet once spat in his clothes.
Sahih Bukhari,1,4,243,Ablution (Wudu'),"Narrated by Aisha: The Prophet said, ""All drinks that produce intoxication are Haram (forbidden to drink)."
Sahih Bukhari,1,4,244,Ablution (Wudu'),"Narrated by Abu Hazim: Sahl bin Sa'd As-Sa'idi, was asked by the people, ""With what was the wound of the Prophet treated? Sahl replied, ""None remains among the people living who knows that better than I. 'Ah used to bring water in his shield and Fatima used to wash the blood off his face. Then straw mat was burnt and the wound was filled with it."""
Sahih Bukhari,1,4,245,Ablution (Wudu'),"Narrated by Abu Burda: My father said, ""I came to the Prophet and saw him carrying a Siwak in his hand and cleansing his teeth, saying, 'U' U',"" as if he was retching while the Siwak was in his mouth."""
Sahih Bukhari,1,4,246,Ablution (Wudu'),"Narrated by Hudhaifa: Whenever the Prophet got up at night, he used to clean his mouth with Siwak."
Sahih Bukhari,1,4,247,Ablution (Wudu'),"Narrated by Al-Bara 'bin 'Azib: The Prophet said to me, ""Whenever you go to bed perform ablution like that for the prayer, lie or your right side and say, ""Allahumma aslamtu wajhi ilaika, wa fauwadtu amri ilaika, wa alja'tu Zahri ilaika raghbatan wa rahbatan ilaika. La Malja' wa la manja minka illa ilaika. Allahumma amantu bikitabika-l-ladhi anzalta wa bina-biyika-l ladhi arsalta"" (O Allah! I surrender to You and entrust all my affairs to You and depend upon You for Your Blessings both with hope and fear of You. There is no fleeing from You, and there is no place of protection and safety except with You O Allah! I believe in Your Book (the Qur'an) which You have revealed and in Your Prophet (Muhammad) whom You have sent). Then if you die on that very night, you will die with faith (i.e. or the religion of Islam). Let the aforesaid words be your last utterance (before sleep)."" I repeated it before the Prophet and when I reached ""Allahumma amantu bikitabika-l-ladhi anzalta (O Allah I believe in Your Book which You have revealed)."" I said, ""Wa-rasulika (and your Apostle)."" The Prophet said, ""No, (but say): 'Wanabiyika-l-ladhi arsalta (Your Prophet whom You have sent), instead."""
Sahih Bukhari,1,5,248,Bathing (Ghusl),"Narrated by 'Aisha: Whenever the Prophet took a bath after Janaba he started by washing his hands and then performed ablution like that for the prayer. After that he would put his fingers in water and move the roots of his hair with them, and then pour three handfuls of water over his head and then pour water all over his body."
Sahih Bukhari,1,5,249,Bathing (Ghusl),Narrated by Maimuna (the wife of the Prophet): Allah's Apostle performed ablution like that for the prayer but did not wash his feet. He washed off the discharge from his private parts and then poured water over his body. He withdrew his feet from that place (the place where he took the bath) and then washed them. And that was his way of taking the bath of Janaba.
Sahih Bukhari,1,5,250,Bathing (Ghusl),Narrated by 'Aisha: The Prophet and I used to take a bath from a single pot called 'Faraq'.
Sahih Bukhari,1,5,251,Bathing (Ghusl),Narrated by Abu Salama: 'Aisha's brother and I went to 'Aisha and he asked her about the bath of the Prophet. She brought a pot containing about a Sa' of water and took a bath and poured it over her head and at what time there was a screen between her and us.
Sahih Bukhari,1,5,252,Bathing (Ghusl),"Narrated by Abu Ja'far: While I and my father were with Jabir bin 'Abdullah, some People asked him about taking a bath He replied, ""A Sa' of water is sufficient for you."" A man said, ""A Sa' is not sufficient for me."" Jabir said, ""A Sa was sufficient for one who had more hair than you and was better than you (meaning the Prophet)."" And then Jabir (put on) his garment and led the prayer."
Sahih Bukhari,1,5,253,Bathing (Ghusl),Narrated by Ibn 'Abbas: The Prophet and Maimuna used to take a bath from a single pot.
Sahih Bukhari,1,5,254,Bathing (Ghusl),"Narrated by Jubair bin Mutim: Allah's Apostle said, ""As for me, I pour water three times on my head."" And he pointed with both his hands."
Sahih Bukhari,1,5,255,Bathing (Ghusl),Narrated by Jabir bin 'Abdullah: The Prophet used to pour water three times on his head.
Sahih Bukhari,1,5,256,Bathing (Ghusl),"Narrated by Abu Ja'far: Jabir bin Abdullah said to me, ""Your cousin (Hasan bin Muhammad bin Al-Hanafiya) came to me and asked about the bath of Janaba. I replied, 'The Prophet uses to take three handfuls of water, pour them on his head and then pour more water over his body.' Al-Hasan said to me, 'I am a hairy man.' I replied, 'The Prophet had more hair than you'. """
Sahih Bukhari,1,5,257,Bathing (Ghusl),"Narrated by Maimuna: I placed water for the bath of the Prophet. He washed his hands twice or thrice and then poured water on his left hand and washed his private parts. He rubbed his hands over the earth (and cleaned them), rinsed his mouth, washed his nose by putting water in it and blowing it out, washed his face and both forearms and then poured water over his body. Then he withdrew from that place and washed his feet."
Sahih Bukhari,1,5,258,Bathing (Ghusl),"Narrated by 'Aisha: Whenever the Prophet took the bath of Janaba (sexual relation or wet dream) he asked for the Hilab or some other scent. He used to take it in his hand, rub it first over the right side of his head and then over the left and then rub the middle of his head with both hands."
Sahih Bukhari,1,5,259,Bathing (Ghusl),"Narrated by Maimuna: I placed water for the bath of the Prophet and he poured water with his right hand on his left and washed them. Then he washed his private parts and rubbed his hands on the ground, washed them with water, rinsed his mouth and washed his nose by putting water in it and blowing it out, washed his face and poured water on his head. He withdrew from that place and washed his feet. A piece of cloth (towel) was given to him but he did not use it."
Sahih Bukhari,1,5,260,Bathing (Ghusl),"Narrated by Maimuna: The Prophet took the bath of Janaba. (sexual relation or wet dream). He first cleaned his private parts with his hand, and then rubbed it(that hand) on the wall (earth) and washed it. Then he performed ablution like that for the prayer, and after the bath he washed his feet."
Sahih Bukhari,1,5,261,Bathing (Ghusl),Narrated by Aisha: The Prophet and I used to take a bath from a single pot of water and our hands used to go in the pot after each other in turn.
Sahih Bukhari,1,5,262,Bathing (Ghusl),"Narrated by 'Aisha: Whenever Allah's Apostle took a bath of Janaba, he washed his hands first."
Sahih Bukhari,1,5,263,Bathing (Ghusl),Narrated by 'Aisha: The Prophet and I used to take a bath from a single pot of water after Janaba.
Sahih Bukhari,1,5,264,Bathing (Ghusl),"Narrated by Anas bin Malik: The Prophet and one of his wives used to take a bath from a single pot of water. (Shu'ba added to Anas's Statement ""After the Janaba"")."
Sahih Bukhari,1,5,265,Bathing (Ghusl),"Narrated by Maimuna: I placed water for the bath of Allah's Apostle and he poured water over his hands and washed them twice or thrice; then he poured water with his right hand over his left and washed his private parts (with his left hand). He rubbed his hand over the earth and rinsed his mouth and washed his nose by putting water in it and blowing it out. After that he washed his face, both fore arms and head thrice and then poured water over his body. He withdrew from that place and washed his feet."
Sahih Bukhari,1,5,266,Bathing (Ghusl),"Narrated by Maimuna bint Al-Harith: I placed water for the bath of Allah's Apostle and put a screen. He poured water over his hands, and washed them once or twice. (The subnarrator added that he did not remember if she had said thrice or not). Then he poured water with his right hand over his left one and washed his private parts. He rubbed his hand over the earth or the wall and washed it. He rinsed his mouth and washed his nose by putting water in it and blowing it out. He washed his face, forearms and head. He poured water over his body and then withdrew from that place and washed his feet. I presented him a piece of cloth (towel) and he pointed with his hand (that he does not want it) and did not take it."
Sahih Bukhari,1,5,267,Bathing (Ghusl),"Narrated by Muhammad bin Al-Muntathir: On the authority of his father that he had asked 'Aisha (about the Hadith of Ibn 'Umar). She said, ""May Allah be Merciful to Abu 'Abdur-Rahman. I used to put scent on Allah's Apostle and he used to go round his wives, and in the morning he assumed the Ihram, and the fragrance of scent was still coming out from his body."""
Sahih Bukhari,1,5,268,Bathing (Ghusl),"Narrated by Qatada: Anas bin Malik said, ""The Prophet used to visit all his wives in a round, during the day and night and they were eleven in number."" I asked Anas, ""Had the Prophet the strength for it?"" Anas replied, ""We used to say that the Prophet was given the strength of thirty (men)."" And Sa'id said on the authority of Qatada that Anas had told him about nine wives only (not eleven)."
Sahih Bukhari,1,5,269,Bathing (Ghusl),"Narrated by 'Ali: I used to get emotional urethral discharge frequently. Being the son-in-law of the Prophet I requested a man to ask him about it. So the man asked the Prophet about it. The Prophet replied, ""Perform ablution after washing your organ (penis)."""
Sahih Bukhari,1,5,270,Bathing (Ghusl),"Narrated by Muhammad bin Al-Muntathir: On the authority of his father that he had asked 'Aisha about the saying of Ibn 'Umar(i.e. he did not like to be a Muhrim while the smell of scent was still coming from his body). 'Aisha said, ""I scented Allah's Apostle and he went round (had sexual intercourse with) all his wives, and in the morning he was Muhrim (after taking a bath)."""
Sahih Bukhari,1,5,271,Bathing (Ghusl),Narrated by 'Aisha: It is as if I am just looking at the glitter of scent in the parting of the Prophet's head hair while he was a Muhrim.
Sahih Bukhari,1,5,272,Bathing (Ghusl),"Narrated by Hisham bin 'Urwa: (on the authority of his father) 'Aisha said, ""Whenever Allah's Apostle took the bath of Janaba, he cleaned his hands and performed ablution like that for prayer and then took a bath and rubbed his hair, till he felt that the whole skin of the head had become wet, then he would pour water thrice and wash the rest of the body."" 'Aisha further said, ""I and Allah's Apostle used to take a bath from a single water container, from which we took water simultaneously."""
Sahih Bukhari,1,5,273,Bathing (Ghusl),"Narrated by Maimuna: Water was placed for the ablution of Allah's Apostle after Janaba. He poured water with his right hand over his left twice or thrice and then washed his private parts and rubbed his hand on the earth or on a wall twice or thrice and then rinsed his mouth, washed his nose by putting water in it and then blowing it out arid then washed his face and forearms and poured water over his head and washed his body. Then he shifted from that place and washed his feet. I brought a piece of cloth, but he did not take it and removed the traces of water from his body with his hand."""
Sahih Bukhari,1,5,274,Bathing (Ghusl),"Narrated by Abu Huraira: Once the call (Iqama) for the prayer was announced and the rows were straightened. Allah's Apostle came out; and when he stood up at his Musalla, he remembered that he was Junub. Then he ordered us to stay at our places and went to take a bath and then returned with water dropping from his head. He said, ""Allahu-Akbar"", and we all offered the prayer with him."
Sahih Bukhari,1,5,275,Bathing (Ghusl),"Narrated by Maimuna: I placed water for the bath of the Prophet and screened him with a garment. He poured water over his hands and washed them. After that he poured water with his right hand over his left and washed his private parts, rubbed his hands with earth and washed them, rinsed his mouth, washed his nose by putting water in it and then blowing it out and then washed his face and forearms. He poured water over his head and body. He then shifted from that place and washed his feet. I gave him a piece of cloth but he did not take it and came out removing the water (from his body) with both his hands."
Sahih Bukhari,1,5,276,Bathing (Ghusl),"Narrated by Aisha: Whenever any one of us was Junub, she poured water over her head thrice with both her hands and then rubbed the right side of her head with one hand and rubbed the left side of the head with the other hand."
Sahih Bukhari,1,5,277,Bathing (Ghusl),"Narrated by Abu Huraira: The Prophet said, 'The (people of) Bani Israel used to take bath naked (all together) looking at each other. The Prophet Moses used to take a bath alone. They said, 'By Allah! Nothing prevents Moses from taking a bath with us except that he has a scrotal hernia.' So once Moses went out to take a bath and put his clothes over a stone and then that stone ran away with his clothes. Moses followed that stone saying, ""My clothes, O stone! My clothes, O stone! till the people of Bani Israel saw him and said, 'By Allah, Moses has got no defect in his body. Moses took his clothes and began to beat the stone."" Abu Huraira added, ""By Allah! There are still six or seven marks present on the stone from that excessive beating."" Narrated Abu Huraira: The Prophet said, ""When the Prophet Job (Aiyub) was taking a bath naked, golden locusts began to fall on him. Job started collecting them in his clothes. His Lord addressed him, 'O Job! Haven't I given you enough so that you are not in need of them.' Job replied, 'Yes!' By Your Honor (power)! But I cannot dispense with Your Blessings.' """
Sahih Bukhari,1,5,278,Bathing (Ghusl),"Narrated by Um Hani bint Abi Talib: I went to Allah's Apostle in the year of the conquest of Mecca and found him taking a bath while Fatima was screening him. The Prophet asked, ""Who is it?"" I replied, ""I am Um-Hani."""
Sahih Bukhari,1,5,279,Bathing (Ghusl),"Narrated by Maimuna: I screened the Prophet while he was taking a bath of Janaba. He washed his hands, poured water from his right hand over his left and washed his private parts. Then he rubbed his hand over a wall or the earth, and performed ablution similar to that for the prayer but did not wash his feet. Then he poured water over his body, shifted from that place, and washed his feet."
Sahih Bukhari,1,5,280,Bathing (Ghusl),"Narrated by Um-Salama: (the mother of the believers) Um Sulaim, the wife of Abu Talha, came to Allah's Apostle and said, ""O Allah's Apostle! Verily Allah is not shy of (telling you) the truth. Is it necessary for a woman to take a bath after she has a wet dream (nocturnal sexual discharge)?"" Allah's Apostle replied, ""Yes, if she notices a discharge."""
Sahih Bukhari,1,5,281,Bathing (Ghusl),"Narrated by Abu Huraira: The Prophet came across me in one of the streets of Medina and at that time I was Junub. So I slipped away from him and went to take a bath. On my return the Prophet said, ""O Abu Huraira! Where have you been?"" I replied, ""I was Junub, so I disliked to sit in your company."" The Prophet said, ""Subhan Allah! A believer never becomes impure."""
Sahih Bukhari,1,5,282,Bathing (Ghusl),Narrated by Anas bin Malik: The Prophet used to visit all his wives in one night and he had nine wives at that time.
Sahih Bukhari,1,5,283,Bathing (Ghusl),"Narrated by Abu Huraira: Allah's Apostle came across me and I was Junub He took my hand and I went along with him till he sat down I slipped away, went home and took a bath. When I came back. he was still sitting there. He then said to me, ""O AbuHuraira! Where have you been?' I told him about it The Prophet said, ""Subhan Allah! O Abu Huraira! A believer never becomes impure."""
Sahih Bukhari,1,5,284,Bathing (Ghusl),"Narrated by Abu Salama: I asked 'Aisha ""Did the Prophet use to sleep while he was Junub?"" She replied, ""Yes, but he used to perform ablution (before going to bed)."
Sahih Bukhari,1,5,285,Bathing (Ghusl),"Narrated by 'Umar bin Al-Khattab: I asked Allah's Apostle ""Can any one of us sleep while he is Junub?"" He replied, ""Yes, if he performs ablution, he can sleep while he is Junub."""
Sahih Bukhari,1,5,286,Bathing (Ghusl),"Narrated by 'Aisha: Whenever the Prophet intended to sleep while he was Junub, he used to wash his private parts and perform ablution like that for the prayer."
Sahih Bukhari,1,5,287,Bathing (Ghusl),"Narrated by 'Abdullah: 'Umar asked the Prophet ""Can anyone of us sleep while he is Junub?"" He replied, ""Yes, if he performs ablution."""
Sahih Bukhari,1,5,288,Bathing (Ghusl),"Narrated by 'Abdullah bin 'Umar: Umar bin Al-Khattab told Allah's Apostle, ""I became Junub at night."" Allah's Apostle replied, ""Perform ablution after washing your private parts and then sleep."""
Sahih Bukhari,1,5,289,Bathing (Ghusl),Narrated by Hisham: as the following Hadith 290.
Sahih Bukhari,1,5,290,Bathing (Ghusl),"Narrated by Abu Huraira: The Prophet said, ""When a man sits in between the four parts of a woman and did the sexual intercourse with her, bath becomes compulsory."""
Sahih Bukhari,1,5,291,Bathing (Ghusl),"Narrated by Zaid bin Khalid AjJuhani: I asked 'Uthman bin 'Affan about a man who engaged in the sexual intercourse with his wife but did not discharge. 'Uthman replied, ""He should perform ablution like that for the prayer after washing his private parts."" 'Uthman added, ""I heard that from Allah's Apostle."" I asked 'Ali bin Abi Talib, Az-Zubair bin Al-'Awwam, Talha bin 'Ubaidullah and Ubai bin Ka'b and a gave the same reply. (Abu Aiylub said that he had heard that from Allah's Apostle ) (This order was cancelled later on so one has to take a bath. See, Hadith No. 180)."
Sahih Bukhari,1,5,292,Bathing (Ghusl),"Narrated by Ubai bin Ka'b: I asked Allah's Apostle about a man who engages in sexual intercourse with his wife but does not discharge. He replied, ""He should wash the parts which comes in contact with the private parts of the woman, perform ablution and then pray."" (Abu 'Abdullah said, ""Taking a bath is safer and is the last order."")"
